<?xml version="1.0" encoding="iso-8859-1"?>
<!DOCTYPE vpat SYSTEM "vpat.dtd">

<vpat>
<body description="John" file_name="john.xml" >
   <joint description="root" parent="null" type="uniaxial">
      <dof description="flexionR">
         <position x="3.15" y="-118.2" z="-0.7"/>
         <axis x="1.0" y="0.0" z="0.0"/>
         <range min="0" max="0"/>
         <comfort_range min="0.2" max="0.8" rest="0.0"/>
      </dof>
      <shape description="skull" file_name="skull.iv">
         <position x="-3.15" y="8.2" z="0.7"/>
         <iaxis x="1.0" y="0.0" z="0.0"/>
         <jaxis x="0.0" y="1.0" z="0.0"/>
         <kaxis x="0.0" y="0.0" z="1.0"/>
      </shape>
   </joint>
   <joint description="mandi" parent="root" type="biaxial">
         <dof description="flexionK">
            <position x="-2.48" y="17.05" z="0.0"/>
            <axis x="1.0" y="0.0" z="0.0"/>
            <range min="0.0" max="0.0"/>
            <comfort_range min="-0.3" max="0.4" rest="0.0"/>
         </dof>
         <shape description="jawl" file_name="jaw.iv">
            <position x="-3.15" y="25.25" z="3.18"/>
            <iaxis x="1.0" y="0.0" z="0.0"/>
            <jaxis x="0.0" y="1.0" z="0.0"/>
            <kaxis x="0.0" y="0.0" z="1.0"/>
         </shape>     
   </joint>
</body>
<movement body_name="john" cycle="on" delta_t="0.05" time_err="0.0001"> 
<motion joint_name="mandi" t0="-1" tf="0.0" type="FLEX" parameter="1"/>
</movement>
</vpat>